id,type,desc,category,concept,dataset,name
own rent,text,"
Profiling question. Question: Do you currently own or rent your place of residence? || Possible Answers: Own|Rent
",,,cjcn-85t7,Measuring Progress Questionnaire - Safety In The City
residence,text,"
Profiling question. Question: What type of residence do you live in? || Possible Answers: House|Duplex|Four-plex|Apartment|Condo|Townhouse|Other
",,,cjcn-85t7,Measuring Progress Questionnaire - Safety In The City
born in canada,text,"
Profiling question. Question: Were you? || Possible Answers: Born in Canada|Moved to Canada from somewhere else
",,,cjcn-85t7,Measuring Progress Questionnaire - Safety In The City
fsa,text,"
Forward Sortation Area (first 3 characters of postal code)
",postal_code,area,cjcn-85t7,Measuring Progress Questionnaire - Safety In The City
qdr,text,"
Profiling question. Question: City Quadrant? || Possible Answers: NW|NE|SE|SW
",quadrant,area,cjcn-85t7,Measuring Progress Questionnaire - Safety In The City
ab school number,number,Unique id number designated by the Alberta Department of Education for a particular school,,,f6w2-hzex,Edmonton Catholic Schools (2016 - 2017)
school name,text,Name of School,,,f6w2-hzex,Edmonton Catholic Schools (2016 - 2017)
street,text,Street address for School,address,location,f6w2-hzex,Edmonton Catholic Schools (2016 - 2017)
postal code,text,Postal Code for School,postal_code,area,f6w2-hzex,Edmonton Catholic Schools (2016 - 2017)
ward,number,School Ward Number,ward_number,area,f6w2-hzex,Edmonton Catholic Schools (2016 - 2017)
phone number,number,Phone Number for School,phone,phone,f6w2-hzex,Edmonton Catholic Schools (2016 - 2017)
fax number,number,Fax number for school,phone,phone,f6w2-hzex,Edmonton Catholic Schools (2016 - 2017)
email,email,E-mail address for School,email,email,f6w2-hzex,Edmonton Catholic Schools (2016 - 2017)
website,url,,url,url,f6w2-hzex,Edmonton Catholic Schools (2016 - 2017)
grade level,text,Grade Level(s) for School,,,f6w2-hzex,Edmonton Catholic Schools (2016 - 2017)
grades offered,text,Range of Grade years offered by the school,,,f6w2-hzex,Edmonton Catholic Schools (2016 - 2017)
programs,text,Educational Programs offered at the School,,,f6w2-hzex,Edmonton Catholic Schools (2016 - 2017)
latitude,number,Latitude coordinates for School,latitude,location,f6w2-hzex,Edmonton Catholic Schools (2016 - 2017)
longitude,number,Longitude coordinates for School,longitude,location,f6w2-hzex,Edmonton Catholic Schools (2016 - 2017)
location,location,Geographic coordinates for school,location,location,f6w2-hzex,Edmonton Catholic Schools (2016 - 2017)
meeting id,number,Foreign Key Identifier - see Meeting Details dataset for the type and date of the meeting,,,vz4x-u2sk,2017-2021 Council And Committee Meetings - Motions
item id,number,Foreign Key Identifier - see Agenda Items dataset for the related agenda item,,,vz4x-u2sk,2017-2021 Council And Committee Meetings - Motions
motion id,text,Primary Key / Unique Motion Identifier. It's Hex-based ID.,,,vz4x-u2sk,2017-2021 Council And Committee Meetings - Motions
motion mover,text,Name of the committee member who introduced the motion,,,vz4x-u2sk,2017-2021 Council And Committee Meetings - Motions
motion seconder,text,A Seconder is only required for motions made at Council meetings (it is not required for Committee meetings).,,,vz4x-u2sk,2017-2021 Council And Committee Meetings - Motions
motion description,text,Text of the motion or inquiry as introduced to the committee,,,vz4x-u2sk,2017-2021 Council And Committee Meetings - Motions
motion status,text,Indicates whether the motion was 'Carried' or 'Failed'.  A status of 'None' or 'No Vote' indicates that no vote was taken on the motion or inquiry.,,,vz4x-u2sk,2017-2021 Council And Committee Meetings - Motions
citizenship,text,Type of Citizenship,,,7xen-yxhv,2014 Census - Population by Citizenship (Citywide)
population,number,Total Number of Individuals,population,population,7xen-yxhv,2014 Census - Population by Citizenship (Citywide)
proclamation date,calendar_date,Date Proclamation made,date,time,avu6-pknu,City Proclamations List
status,text,Situation of Proclamation - Complete,,,avu6-pknu,City Proclamations List
proclamation,text,Name of Proclamation,,,avu6-pknu,City Proclamations List
link,url,Web Link to view to see Proclamation details,url,url,avu6-pknu,City Proclamations List
responsedate,calendar_date,,date,time,mtj3-59sb,River Crossing Heritage Interpretive Plan - Edmonton Insight Community
completiondate,calendar_date,,date,time,mtj3-59sb,River Crossing Heritage Interpretive Plan - Edmonton Insight Community
ostype,text,,,,mtj3-59sb,River Crossing Heritage Interpretive Plan - Edmonton Insight Community
devicetype,text,,,,mtj3-59sb,River Crossing Heritage Interpretive Plan - Edmonton Insight Community
browsertype,text,,,,mtj3-59sb,River Crossing Heritage Interpretive Plan - Edmonton Insight Community
ward,text,City Ward Number,ward_name,area,siae-h3wc,2016 Census - Population by Length of Residence (Neighbourhood/Ward)
neighbourhood number,number,Unique Neighbourhood Identifier,neighbourbood_id,area,siae-h3wc,2016 Census - Population by Length of Residence (Neighbourhood/Ward)
neighbourhood name,text,Neighbourhood Name,neighbourbood_name,area,siae-h3wc,2016 Census - Population by Length of Residence (Neighbourhood/Ward)
5 years or more,number,Number of respondents ,population,population,siae-h3wc,2016 Census - Population by Length of Residence (Neighbourhood/Ward)
no response,number,Number of respondents that provided No Response,population,population,siae-h3wc,2016 Census - Population by Length of Residence (Neighbourhood/Ward)
pay machine id,text,Internal ID Number assigned to the Pay Machine,,,6iyz-9q3c,EPark Pay Machine Locations
latitude,number,Latitude portion of the Pay Machine Location,latitude,location,6iyz-9q3c,EPark Pay Machine Locations
longitude,number,Longitude portion of the Pay Machine Location,longitude,location,6iyz-9q3c,EPark Pay Machine Locations
google coordinates,text,The Google geo coordinates (since the source is a Google Map),,location,6iyz-9q3c,EPark Pay Machine Locations
pay machine location,location,The combination of the Latitude and Longitude used for mapping purposes.,location,location,6iyz-9q3c,EPark Pay Machine Locations
location name,text,Name of the place where the WiFi antenna is located.,,location,vbxz-36ag,Open City Wi-Fi Locations
address,text,Physical Street address where the WiFi antenna is located.,address,location,vbxz-36ag,Open City Wi-Fi Locations
facility type,text,Type of location where WiFi antenna is found.,,,vbxz-36ag,Open City Wi-Fi Locations
status,text,Implementation status of the WiFi antenna at a given location.,,,vbxz-36ag,Open City Wi-Fi Locations
wifiprovider,text,Name of an organization providing the WiFi service to the public.,,,vbxz-36ag,Open City Wi-Fi Locations
latitude,number,Horizontal Geographic coordinate of Location,latitude,location,vbxz-36ag,Open City Wi-Fi Locations
longitude,number,Vertical Geographic coordinate of Location,longitude,location,vbxz-36ag,Open City Wi-Fi Locations
location,location,Spatial coordinates of Location,location,location,vbxz-36ag,Open City Wi-Fi Locations
station name,text,,,,b4y7-zhnz,Fire Stations
address,text,,address,location,b4y7-zhnz,Fire Stations
district,text,,district,area,b4y7-zhnz,Fire Stations
fire rescue ems combined,text,,,,b4y7-zhnz,Fire Stations
latitude,number,,latitude,location,b4y7-zhnz,Fire Stations
longitude,number,,longitude,location,b4y7-zhnz,Fire Stations
location,location,,location,location,b4y7-zhnz,Fire Stations
collision location name,text,Intersection name where the collisions occurred,,location,rpc2-fbcm,Top Ten Collision Locations (2016)
number of collisions,number,Number of Collisions,,,rpc2-fbcm,Top Ten Collision Locations (2016)
location,location,Latitude and longitude of the location,location,location,rpc2-fbcm,Top Ten Collision Locations (2016)
maintenance area,number,Unique identifier for a particular Maintenance Area,,area,h9sn-ds8j,Residential Street Cleaning Schedule
neighbourhood name,text,Name of Neighbourhood where street cleaning activity is going to occur,neighbourbood_name,area,h9sn-ds8j,Residential Street Cleaning Schedule
the week of:,calendar_date,The week when street cleaning activity is scheduled in the Neighbourhood,date,time,h9sn-ds8j,Residential Street Cleaning Schedule
earliest scheduled start date,calendar_date,,date,time,h9sn-ds8j,Residential Street Cleaning Schedule
latest scheduled start date,calendar_date,,date,time,h9sn-ds8j,Residential Street Cleaning Schedule
planned start date,text,,date,time,h9sn-ds8j,Residential Street Cleaning Schedule
status,text,Status for street cleaning activity in Neighbourhood. Note: TBD means To Be Determined,,,h9sn-ds8j,Residential Street Cleaning Schedule
location,location,"(latitude, longitude)",location,location,h9sn-ds8j,Residential Street Cleaning Schedule
data update,calendar_date,Details of when the dataset was updated,date,time,h9sn-ds8j,Residential Street Cleaning Schedule
responsedate,calendar_date,,date,time,25yk-jmjh,Public Engagement - Edmonton Insight Community
completiondate,calendar_date,,date,time,25yk-jmjh,Public Engagement - Edmonton Insight Community
ostype,text,,,,25yk-jmjh,Public Engagement - Edmonton Insight Community
devicetype,text,,,,25yk-jmjh,Public Engagement - Edmonton Insight Community
browsertype,text,,,,25yk-jmjh,Public Engagement - Edmonton Insight Community
councillor,text,,,,igga-nzee,Councillors' Common Travel And Training (2014 - 2016)
date,text,,date,time,igga-nzee,Councillors' Common Travel And Training (2014 - 2016)
location,text,,location,location,igga-nzee,Councillors' Common Travel And Training (2014 - 2016)
purpose,text,,,,igga-nzee,Councillors' Common Travel And Training (2014 - 2016)
cost,money,,,,igga-nzee,Councillors' Common Travel And Training (2014 - 2016)
year,number,,year,time,igga-nzee,Councillors' Common Travel And Training (2014 - 2016)
ward,text,City Ward Number,ward_name,area,etyh-hnr8,2014 Census - Dwelling Unit By Language (Neighbourhood)
neighbourhood number,number,Unique Neighbourhood Identifier,neighbourbood_id,area,etyh-hnr8,2014 Census - Dwelling Unit By Language (Neighbourhood)
neighbourhood name,text,Neighbourhood Name,neighbourbood_name,area,etyh-hnr8,2014 Census - Dwelling Unit By Language (Neighbourhood)
english only,number,Number of Households ,population,population,etyh-hnr8,2014 Census - Dwelling Unit By Language (Neighbourhood)
arabic,number,Number of Households ,population,population,etyh-hnr8,2014 Census - Dwelling Unit By Language (Neighbourhood)
cantonese,number,Number of Households ,population,population,etyh-hnr8,2014 Census - Dwelling Unit By Language (Neighbourhood)
french,number,Number of Households ,population,population,etyh-hnr8,2014 Census - Dwelling Unit By Language (Neighbourhood)
german,number,,population,population,etyh-hnr8,2014 Census - Dwelling Unit By Language (Neighbourhood)
mandarin,number,Number of Households ,population,population,etyh-hnr8,2014 Census - Dwelling Unit By Language (Neighbourhood)
panjabi (punjabi),number,Number of Households ,population,population,etyh-hnr8,2014 Census - Dwelling Unit By Language (Neighbourhood)
spanish,number,Number of Households ,population,population,etyh-hnr8,2014 Census - Dwelling Unit By Language (Neighbourhood)
tagalog (pilipino filipino),number,Number of Households ,population,population,etyh-hnr8,2014 Census - Dwelling Unit By Language (Neighbourhood)
ukrainian,number,Number of Households ,population,population,etyh-hnr8,2014 Census - Dwelling Unit By Language (Neighbourhood)
other,number,Number of Households ,population,population,etyh-hnr8,2014 Census - Dwelling Unit By Language (Neighbourhood)
no response,number,Number of Households ,population,population,etyh-hnr8,2014 Census - Dwelling Unit By Language (Neighbourhood)
named place,text,Place name used at a specific location within Edmonton.,,location,59sa-iw7i,Indigenous Place Names of Edmonton
location description,text,A geographic description of the place name location.,,,59sa-iw7i,Indigenous Place Names of Edmonton
location type,text,"The type of place feature (for instance road, neighbourhood) named.",,,59sa-iw7i,Indigenous Place Names of Edmonton
year,number,The year that the place feature was named.,year,time,59sa-iw7i,Indigenous Place Names of Edmonton
name origin,text,The origin and description of the place name.,,,59sa-iw7i,Indigenous Place Names of Edmonton
latitude,number,The latitude of named place location.,latitude,location,59sa-iw7i,Indigenous Place Names of Edmonton
longitude,number,The longitude of named place location,longitude,location,59sa-iw7i,Indigenous Place Names of Edmonton
location,location,,location,location,59sa-iw7i,Indigenous Place Names of Edmonton
year,number,Calendar Year,year,time,25sf-z8zd,Residential Building Permits 2009-2014
neighbourhood,text,City of Edmonton Neighbourhood,neighbourbood_name,area,25sf-z8zd,Residential Building Permits 2009-2014
city sector,text,General Geographic Area of City,,area,25sf-z8zd,Residential Building Permits 2009-2014
typology,text,"General Neighbourhood classification based on the the Way We Grow, geographic location and age",,,25sf-z8zd,Residential Building Permits 2009-2014
neighbourhood number,number,Unique Neighbourhood Identifier,neighbourbood_id,area,25sf-z8zd,Residential Building Permits 2009-2014
ward,number,City Ward,ward_number,area,25sf-z8zd,Residential Building Permits 2009-2014
traffic district,number,Unique Transportation Management Area as identified by Transportation Services,,area,25sf-z8zd,Residential Building Permits 2009-2014
total construction value ($),money,Total Declared Construction Values Summed-up from Building Permits,,,25sf-z8zd,Residential Building Permits 2009-2014
number of permits,number,All building permits issued in the neighbourhood,,,25sf-z8zd,Residential Building Permits 2009-2014
number of additions,number,Additions to Primary Residence (does not include additions to accessory buildings),,,25sf-z8zd,Residential Building Permits 2009-2014
interior/exterior alterations,number,"Changes to the inside or outside of an existing building. Includes foundation repairs to low-density residential buildings. Also, includes decks.",,,25sf-z8zd,Residential Building Permits 2009-2014
accessory buildings,number,Construction or alteration of buildings that are accessory to the primary building (ex. garage),,,25sf-z8zd,Residential Building Permits 2009-2014
hot tubs/ pools,number,"New hot tubs or pools. Also, includes man-made ponds",,,25sf-z8zd,Residential Building Permits 2009-2014
foundation/ structure,number,Foundation construction for apartment buildings and other multi-family projects,,,25sf-z8zd,Residential Building Permits 2009-2014
accessory buildings demolished,number,Demolition of accessory buildings (ex. garage). A demolition permit may not be issued building will be replaced.,,,25sf-z8zd,Residential Building Permits 2009-2014
multi-family suites,number,Additional suite creation within an existing multi-family building. This does not include secondary suites.,,,25sf-z8zd,Residential Building Permits 2009-2014
secondary suites,number,Additional suite creation within an existing single-family building. ,,,25sf-z8zd,Residential Building Permits 2009-2014
garden suites,number,Free standing residential suite constructed as an accessory building.,,,25sf-z8zd,Residential Building Permits 2009-2014
garage suites,number,Free standing residential suite constructed as an accessory building that also includes garage parking.,,,25sf-z8zd,Residential Building Permits 2009-2014
new build secondary suites,number,Additional suite creation occurs as part of a new single-family building construction.,,,25sf-z8zd,Residential Building Permits 2009-2014
single-detached,number,Single-detached house. Does not include secondary suites.,,,25sf-z8zd,Residential Building Permits 2009-2014
duplex units,number,"A building containing only two Dwellings, with one Dwelling placed over the other. Each unit is counted individually.",,,25sf-z8zd,Residential Building Permits 2009-2014
semi-detached units,number,"A building containing only two Dwellings, with each Dwelling placed side by side. Each unit is counted individually.",,,25sf-z8zd,Residential Building Permits 2009-2014
row housing units,number,A building containing a row of three or more Dwellings joined in whole or in part at the side. Also includes stacked row housing. Each unit is counted individually.,,,25sf-z8zd,Residential Building Permits 2009-2014
apartment units,number,"Multiple dwellings  contained within a building in which the Dwellings are arranged in any horizontal or vertical configuration, Each unit is counted individually.",,,25sf-z8zd,Residential Building Permits 2009-2014
mobile home units,number,"Transportable Single Detached Housing which is suitable for permanent occupancy, designed to be transported on its own wheels.",,,25sf-z8zd,Residential Building Permits 2009-2014
mobile units demolished,number,Mobile homes are demolished or removed from a site.,,,25sf-z8zd,Residential Building Permits 2009-2014
secondary suites demolished,number,"Secondary Suites removed from primary residence. Note - not all removals require a permit. Therefore, some may not be tracked.",,,25sf-z8zd,Residential Building Permits 2009-2014
single units demolished,number,Single dwelling homes are demolished.,,,25sf-z8zd,Residential Building Permits 2009-2014
multi-family units demolished,number,"Multi dwelling homes are demolished. This includes duplexes, semi-detached homes, row housing and apartment buildings.",,,25sf-z8zd,Residential Building Permits 2009-2014
net units,number,All new dwelling units minus all demolished dwelling units. This includes suites.,,,25sf-z8zd,Residential Building Permits 2009-2014
meeting id,number,Primary Key / Unique meeting identifier,,,kzgq-nq8v,2017-2021 Council And Committee Meetings - Attendance
item id,number,Foreign Key Identifier - see Agenda Items dataset for the related agenda item,,,kzgq-nq8v,2017-2021 Council And Committee Meetings - Attendance
attendee,text,Name of Council or Committee member,,,kzgq-nq8v,2017-2021 Council And Committee Meetings - Attendance
status,text,Indicators if Council or Committee member was present during any part of the meeting,,,kzgq-nq8v,2017-2021 Council And Committee Meetings - Attendance
reference number,text,The unique identifier (number)  for the service request.,,,ukww-xkmj,311 Explorer
date created,calendar_date,The date the service request was submitted.,date,time,ukww-xkmj,311 Explorer
date closed,calendar_date,The date the service request was acted upon. The appropriate City department has investigated the concern and identified steps to resolve your request. Action for resolving the issue may be deferred as work may be dependent on priority and weather conditions or your issue has been closed due to lack of information including contact details. (311 Explorer version),date,time,ukww-xkmj,311 Explorer
request status,text,"Status of the request. It can be either Open or Closed. Open means the service request has been received and assigned to the appropriate City area for review and action. Response times can be dependent on several factors including weather conditions, availability of resources and assessed priority of the work required. Closed means the appropriate City area has investigated your concern and has taken the necessary action to resolve your request. Please call 311 if further information is required.  (311 Open Data Activity Detail version).
",,,ukww-xkmj,311 Explorer
status detail,text, Certain request types may include additional details describing the progress or action associated with the request.,,,ukww-xkmj,311 Explorer
service category,text,The type of activity or service request.,,,ukww-xkmj,311 Explorer
service code,text,Provides a general description of the service request.,,,ukww-xkmj,311 Explorer
business unit,text,The business area that is responsible for the service (311 Explorer version).,,,ukww-xkmj,311 Explorer
neighbourhood,text,The City neighbourhood where the service request is located.,neighbourbood_name,area,ukww-xkmj,311 Explorer
community league,text,The Community League associated with the location of the service. (If applicable),,,ukww-xkmj,311 Explorer
ward,text,The City Ward associated with the location.,ward_name,area,ukww-xkmj,311 Explorer
address,text,The location of the service request.,address,location,ukww-xkmj,311 Explorer
lat,number,Horizontal Geographic Coordinate,latitude,location,ukww-xkmj,311 Explorer
long,number,Vertical Geographic Coordinate,longitude,location,ukww-xkmj,311 Explorer
location,location,Spatial coordinates for the location of the issue that has been identified.,location,location,ukww-xkmj,311 Explorer
ticket source,text,"The channel or method in which the service request was initiated. Examples will include telephone, 311 app or email. ",,,ukww-xkmj,311 Explorer
calendar year,number,Year when Service Ticket was created.,year,time,ukww-xkmj,311 Explorer
count,number,Number of service requests - usually 1. To be used for reporting purposes.,,,ukww-xkmj,311 Explorer
posse number,text,Unique Identifier generated by POSSE,,,ukww-xkmj,311 Explorer
transit ref number,html,A ticket number from any Transit application,,,ukww-xkmj,311 Explorer
ivara ticket num,text,,,,ukww-xkmj,311 Explorer
ward,text,City Ward Number,ward_name,area,aaki-fhf8,2016 Census - Dwelling Unit by Structure Type and Ownership (Ward)
structure type,text,Residential Structure Type,,,aaki-fhf8,2016 Census - Dwelling Unit by Structure Type and Ownership (Ward)
owned,number,Number of Dwellings that are Owned,,,aaki-fhf8,2016 Census - Dwelling Unit by Structure Type and Ownership (Ward)
rented,number,Number of Dwellings that are Rented,,,aaki-fhf8,2016 Census - Dwelling Unit by Structure Type and Ownership (Ward)
no response,number,Number of Dwellings that did not Respond,,,aaki-fhf8,2016 Census - Dwelling Unit by Structure Type and Ownership (Ward)
asset,text,"The City of Edmonton classifies all roadwork and improvements as assets.
",,,zxf6-rv9a,2016 Street Construction Projects
id,text,Internal Project Identifier,,,zxf6-rv9a,2016 Street Construction Projects
start year,text,Proposed Implementation Year,year,time,zxf6-rv9a,2016 Street Construction Projects
approx. start,text,Approximate start date of the project ,date,time,zxf6-rv9a,2016 Street Construction Projects
approx. finish,text,Approximate end date of the project ,date,time,zxf6-rv9a,2016 Street Construction Projects
project limits,text,The limits of the project in the area.,,,zxf6-rv9a,2016 Street Construction Projects
project location,text,Project location and indicator number as found on the printed Construction On Your Streets map and Ward map section.,,location,zxf6-rv9a,2016 Street Construction Projects
latitude,number,,latitude,location,zxf6-rv9a,2016 Street Construction Projects
longitude,number,,longitude,location,zxf6-rv9a,2016 Street Construction Projects
location,location,,location,location,zxf6-rv9a,2016 Street Construction Projects
profile number,text,Internal Profile Number,,,zxf6-rv9a,2016 Street Construction Projects
construction type,text,A description of the type of work being performed.,,,zxf6-rv9a,2016 Street Construction Projects
construction supervisor,text,Contact person for more information.,,,zxf6-rv9a,2016 Street Construction Projects
phone number,text,Phone number for Construction Supervisor,phone,phone,zxf6-rv9a,2016 Street Construction Projects
ward,text,City Ward Number,ward_name,area,zxf6-rv9a,2016 Street Construction Projects
construction by ward,url,This link goes to a page listing all the construction projects scheduled in this Ward.,url,url,zxf6-rv9a,2016 Street Construction Projects
additional info,url,Additional information relating to this project..,url,url,zxf6-rv9a,2016 Street Construction Projects
project status,text,Current status for a particular Construction Project,,,zxf6-rv9a,2016 Street Construction Projects
icon,photo,,,,zxf6-rv9a,2016 Street Construction Projects
ward,text,City Ward Number,ward_name,area,23zz-47uu,2014 Census - Dwelling Unit Status (Ward)
dwelling status,text,Dwelling Status Type,,,23zz-47uu,2014 Census - Dwelling Unit Status (Ward)
dwellings,number,Number of Units,,,23zz-47uu,2014 Census - Dwelling Unit Status (Ward)
responsedate,calendar_date,,date,time,2wiz-k5z2,Your View of Edmonton - Edmonton Insight Community
completiondate,calendar_date,,date,time,2wiz-k5z2,Your View of Edmonton - Edmonton Insight Community
ostype,text,,,,2wiz-k5z2,Your View of Edmonton - Edmonton Insight Community
devicetype,text,,,,2wiz-k5z2,Your View of Edmonton - Edmonton Insight Community
browsertype,text,,,,2wiz-k5z2,Your View of Edmonton - Edmonton Insight Community
facility name,text,Name of Recreational Facility,,,tm8z-k466,Recreational Facilities - Drop In Swim
facility id,number,Unique Facility Identifier,,,tm8z-k466,Recreational Facilities - Drop In Swim
booking date,text,Calendar Date for Activity,date,time,tm8z-k466,Recreational Facilities - Drop In Swim
day,text,Day of the Week for an Activity,day,time,tm8z-k466,Recreational Facilities - Drop In Swim
activity,text,Swimming Activity or Program to be done,,,tm8z-k466,Recreational Facilities - Drop In Swim
time,text,Time when Activity happens,time,time,tm8z-k466,Recreational Facilities - Drop In Swim
number of lanes,number,Number of Lanes available for Activity,,,tm8z-k466,Recreational Facilities - Drop In Swim
site id,text,"System generated, unique identifier associated with the intersection where enforcement is being conducted.",,,7fnd-72gr,Intersection Safety Device Locations
approach,text,The road of travel being driven on that approaches the intersection.,,,7fnd-72gr,Intersection Safety Device Locations
cross street,text,The road being crossed at the intersection.,,,7fnd-72gr,Intersection Safety Device Locations
