id,type,desc,category,concept,dataset,name
responsedate,calendar_date,,date,time,bqy8-r3up,Naturalization - Edmonton Insight Community
completiondate,calendar_date,,date,time,bqy8-r3up,Naturalization - Edmonton Insight Community
ostype,text,,,,bqy8-r3up,Naturalization - Edmonton Insight Community
devicetype,text,,,,bqy8-r3up,Naturalization - Edmonton Insight Community
browsertype,text,,,,bqy8-r3up,Naturalization - Edmonton Insight Community
budget year,number,Calendar year for budget.,year,time,da9s-v9j8,Approved Operating Budget - Expenses
fund type,text,Fund Type of budget item.,type,type,da9s-v9j8,Approved Operating Budget - Expenses
department,text,Name of City Department or Agency responsible for budget item.,,,da9s-v9j8,Approved Operating Budget - Expenses
branch,text,Name of branch responsible for budget item.,,,da9s-v9j8,Approved Operating Budget - Expenses
program,text,Name of program responsible for budget item.,,,da9s-v9j8,Approved Operating Budget - Expenses
category,text,Budget item description.,type,type,da9s-v9j8,Approved Operating Budget - Expenses
account type,text,High-level categorization of budget item - Revenue or Expenses.,,,da9s-v9j8,Approved Operating Budget - Expenses
budget,money,Number of dollars allocated to budget item.,,,da9s-v9j8,Approved Operating Budget - Expenses
name,text,Name of senior centre,,name,zmac-3mxq,Seniors Centres
address,text,Street address for senior centre,address,location,zmac-3mxq,Seniors Centres
latitude,number,Latitude coordinate for senior centre,latitude,location,zmac-3mxq,Seniors Centres
longitude,number,Longitude coordinate for senior centre,longitude,location,zmac-3mxq,Seniors Centres
location,location,Geographic location of senior centre,location,location,zmac-3mxq,Seniors Centres
forward sortation area,text,A forward sortation area (FSA) is a geographical region in which all postal codes start with the same three characters,postal_code,area,bqmh-j34s,Licensed Pets by Breed and Forward Sortation Area (FSA)
animal type,text,Cat or dog,,type,bqmh-j34s,Licensed Pets by Breed and Forward Sortation Area (FSA)
breed,text,"A breed is a group of domestic animals with a homogeneous appearance, behavior, and other characteristics that distinguish it from other animals of the same species, and arrived at through selective breeding.",,,bqmh-j34s,Licensed Pets by Breed and Forward Sortation Area (FSA)
count,number,Number of animals for a certain breed at a certain Forward Sortation Area.,,,bqmh-j34s,Licensed Pets by Breed and Forward Sortation Area (FSA)
responsedate,calendar_date,,date,time,4hht-iw97,Medically Supervised Injection Services - Edmonton Insight Community
completiondate,calendar_date,,date,time,4hht-iw97,Medically Supervised Injection Services - Edmonton Insight Community
ostype,text,,,,4hht-iw97,Medically Supervised Injection Services - Edmonton Insight Community
devicetype,text,,,,4hht-iw97,Medically Supervised Injection Services - Edmonton Insight Community
browsertype,text,,,,4hht-iw97,Medically Supervised Injection Services - Edmonton Insight Community
ward,text,City Ward Number to which a Neighbourhood belongs to.,ward_name,area,bms6-cuv9,2012 Census - Population By Marital Status (Neighbourhood)
neighbourhood number,number,Unique number identifier,neighbourbood_id,area,bms6-cuv9,2012 Census - Population By Marital Status (Neighbourhood)
neighbourhood name,text,"To protect the privacy of individuals, neighbourhood data is not reported for neighbourhoods with populations between 1 and 49 residents.",neighbourbood_name,area,bms6-cuv9,2012 Census - Population By Marital Status (Neighbourhood)
married,number,,,,bms6-cuv9,2012 Census - Population By Marital Status (Neighbourhood)
common-law,number,,,,bms6-cuv9,2012 Census - Population By Marital Status (Neighbourhood)
separated/divorced,number,,,,bms6-cuv9,2012 Census - Population By Marital Status (Neighbourhood)
never married,number,,,,bms6-cuv9,2012 Census - Population By Marital Status (Neighbourhood)
widowed,number,,,,bms6-cuv9,2012 Census - Population By Marital Status (Neighbourhood)
no response,number,,,,bms6-cuv9,2012 Census - Population By Marital Status (Neighbourhood)
structure type,text,,,,htu3-4pz3,2012 Census - Dwelling Units By Structure Type And Length Of Residence (Citywide)
5 years or more,number,,,,htu3-4pz3,2012 Census - Dwelling Units By Structure Type And Length Of Residence (Citywide)
no response,number,,,,htu3-4pz3,2012 Census - Dwelling Units By Structure Type And Length Of Residence (Citywide)
ward,text,City Ward Number,ward_name,area,dzvs-e3up,2016 Census - Population by Length of Residence (Ward)
population,number,Number of respondents for a particular residency length,population,population,dzvs-e3up,2016 Census - Population by Length of Residence (Ward)
meeting id,number,Primary Key / Unique meeting identifier,,,y29c-39y9,2011-2013 Council and Committee Meetings - Meeting Details
meeting type,text,Name of Committee or the type of Council Meeting,,,y29c-39y9,2011-2013 Council and Committee Meetings - Meeting Details
record type,text,Indicates whether the Agenda or Minutes are available for this meeting,,,y29c-39y9,2011-2013 Council and Committee Meetings - Meeting Details
meeting date,calendar_date,Date of meeting,date,time,y29c-39y9,2011-2013 Council and Committee Meetings - Meeting Details
meeting time,text,Time for start of meeting,time,time,y29c-39y9,2011-2013 Council and Committee Meetings - Meeting Details
meeting location,text,Location of Meeting,location,location,y29c-39y9,2011-2013 Council and Committee Meetings - Meeting Details
supplier name,text,Name of supplier providing goods and services to the City.,,,y9rm-5xha,"Purchase Orders Over $10,000"
description,text,Brief description of the goods and services being purchased by the City.,,,y9rm-5xha,"Purchase Orders Over $10,000"
purchase order type,text,Category of Purchase Order.,,,y9rm-5xha,"Purchase Orders Over $10,000"
dollar value category,text,Dollar range of Purchase Order.,,,y9rm-5xha,"Purchase Orders Over $10,000"
create date,calendar_date,Date that the Purchase Order was created.,date,time,y9rm-5xha,"Purchase Orders Over $10,000"
year,number,Year the Purchase Order was created,year,time,y9rm-5xha,"Purchase Orders Over $10,000"
route id,text,ID that uniquely identifies a route,,,d577-xky7,ETS Bus Schedule GTFS Data Feed - Routes
route short name,number,Short name of a route,,,d577-xky7,ETS Bus Schedule GTFS Data Feed - Routes
route long name,text,Full name of a route. This name is generally more descriptive than the route_short_name and will often include the route's destination or stop.,,,d577-xky7,ETS Bus Schedule GTFS Data Feed - Routes
route description,text,Description of route,,,d577-xky7,ETS Bus Schedule GTFS Data Feed - Routes
route type,number,"Type of Transportation used on the route. 0 - Tram, Streetcar; 1 - Subway; 2- Rail; 3- Bus; etc...",,,d577-xky7,ETS Bus Schedule GTFS Data Feed - Routes
route url,url,URL of a web page about that particular route,url,url,d577-xky7,ETS Bus Schedule GTFS Data Feed - Routes
responsedate,calendar_date,,date,time,49fy-4pc4,Traffic Safety Culture - Edmonton Insight Community
completiondate,calendar_date,,date,time,49fy-4pc4,Traffic Safety Culture - Edmonton Insight Community
ostype,text,,,,49fy-4pc4,Traffic Safety Culture - Edmonton Insight Community
devicetype,text,,,,49fy-4pc4,Traffic Safety Culture - Edmonton Insight Community
browsertype,text,,,,49fy-4pc4,Traffic Safety Culture - Edmonton Insight Community
population,number,,population,population,6w5t-p7n9,2012 Census - Population By Mode Of Transportation (Citywide)
ward,text,City Ward Number,ward_name,area,i88k-yen7,2016 Census - Population by Employment Status (Neighbourhood/Ward)
neighbourhood number,number,Unique Neighbourhood Identifier,neighbourbood_id,area,i88k-yen7,2016 Census - Population by Employment Status (Neighbourhood/Ward)
neighbourhood name,text,Neighbourhood name,neighbourbood_name,area,i88k-yen7,2016 Census - Population by Employment Status (Neighbourhood/Ward)
preschool,number,Number of Individuals identified with this Employment Status,,,i88k-yen7,2016 Census - Population by Employment Status (Neighbourhood/Ward)
post secondary student,number,Number of Individuals identified with this Employment Status,,,i88k-yen7,2016 Census - Population by Employment Status (Neighbourhood/Ward)
homemaker,number,Number of Individuals identified with this Employment Status,,,i88k-yen7,2016 Census - Population by Employment Status (Neighbourhood/Ward)
unemployed,number,Number of Individuals identified with this Employment Status,,,i88k-yen7,2016 Census - Population by Employment Status (Neighbourhood/Ward)
retired,number,Number of Individuals identified with this Employment Status,,,i88k-yen7,2016 Census - Population by Employment Status (Neighbourhood/Ward)
permanently unable to work,number,Number of Individuals identified with this Employment Status,,,i88k-yen7,2016 Census - Population by Employment Status (Neighbourhood/Ward)
no response,number,Number of individuals that did not provide a response to this question,,,i88k-yen7,2016 Census - Population by Employment Status (Neighbourhood/Ward)
response date,calendar_date,Date/Time the respondent first opened/started the survey.,date,time,mt3b-mcig,City Communication - Edmonton Insight Community
completion date,calendar_date,Date/Time the respondent finished the survey.,date,time,mt3b-mcig,City Communication - Edmonton Insight Community
ostype,text,"System Captured, OS used by the respondent. Question: OS Type? - OSType Possible Answers: Mac (OS X)/Linux/Windows/iOS/Android/BlackBerry/Unknown",,,mt3b-mcig,City Communication - Edmonton Insight Community
devicetype,text,"System Captured, Device used by the respondent. Question: Device Type? - DeviceType Possible Answers: Tablet/Desktop/Phone",,,mt3b-mcig,City Communication - Edmonton Insight Community
browsertype,text,"System Captured, Browser used by the respondent. Question: Browser Type? - BrowserType Possible Answers: Internet Explorer/Firefox/Safari/Google Chrome/Opera/Android/BlackBerry/Unknown",,,mt3b-mcig,City Communication - Edmonton Insight Community
ward,text,City Ward Number,ward_name,area,i8na-b4eb,2014 Census - Previous Residence If Less Than One Year (Neighbourhood)
neighbourhood number,number,Unique Neighbourhood Identifier,neighbourbood_id,area,i8na-b4eb,2014 Census - Previous Residence If Less Than One Year (Neighbourhood)
neighbourhood name,text,Neighbourhood Name,neighbourbood_name,area,i8na-b4eb,2014 Census - Previous Residence If Less Than One Year (Neighbourhood)
elsewhere in edmonton,number,Number of Individuals for a Particular Location Type,population,population,i8na-b4eb,2014 Census - Previous Residence If Less Than One Year (Neighbourhood)
elsewhere in alberta,number,Number of Individuals for a Particular Location Type,population,population,i8na-b4eb,2014 Census - Previous Residence If Less Than One Year (Neighbourhood)
atlantic canada,number,Number of Individuals for a Particular Location Type,population,population,i8na-b4eb,2014 Census - Previous Residence If Less Than One Year (Neighbourhood)
ontario/quebec,number,Number of Individuals for a Particular Location Type,population,population,i8na-b4eb,2014 Census - Previous Residence If Less Than One Year (Neighbourhood)
territories/manitoba/saskatchewan,number,Number of Individuals for a Particular Location Type,population,population,i8na-b4eb,2014 Census - Previous Residence If Less Than One Year (Neighbourhood)
british columbia,number,Number of Individuals for a Particular Location Type,population,population,i8na-b4eb,2014 Census - Previous Residence If Less Than One Year (Neighbourhood)
outside canada,number,Number of Individuals for a Particular Location Type,population,population,i8na-b4eb,2014 Census - Previous Residence If Less Than One Year (Neighbourhood)
no response,number,Number of Individuals that did not respond,population,population,i8na-b4eb,2014 Census - Previous Residence If Less Than One Year (Neighbourhood)
permit date,calendar_date,The date when Building Permit has been issued.,date,time,24uj-dj8v,General Building Permits
permit number,text,The unique City-issued permit number ,,,24uj-dj8v,General Building Permits
year,number,Year when permit was issued.,year,time,24uj-dj8v,General Building Permits
month number,number,Month number of when permit was issued,month_number,time,24uj-dj8v,General Building Permits
report permit date,calendar_date,Report label,date,time,24uj-dj8v,General Building Permits
job category,text,Type of Building Permit,,,24uj-dj8v,General Building Permits
address,text,Address that the Building Permit was issued for,address,location,24uj-dj8v,General Building Permits
legal description,text,Legal description for address where building permit was issued for.,,,24uj-dj8v,General Building Permits
neighbourhood,text,City Neighbourhood name.,neighbourbood_name,area,24uj-dj8v,General Building Permits
neighbourhood number,text,,neighbourbood_id,area,24uj-dj8v,General Building Permits
job description,text,Description of the building permit issued.,,,24uj-dj8v,General Building Permits
building type,text,Type of Building Structure,,,24uj-dj8v,General Building Permits
work type,text,Type of work to be done.,,,24uj-dj8v,General Building Permits
floor area,number,Square footage of floor area,,,24uj-dj8v,General Building Permits
construction value,number,Estimated value of construction  work ,,,24uj-dj8v,General Building Permits
zoning,text,Land use zone,,area,24uj-dj8v,General Building Permits
units added,number,Change in dwelling unit,,,24uj-dj8v,General Building Permits
latitude,number,Horizontal spatial coordinate,latitude,location,24uj-dj8v,General Building Permits
longitude,number,Vertical spatial coordinate,longitude,location,24uj-dj8v,General Building Permits
location,location,Spatial coordinates for address,location,location,24uj-dj8v,General Building Permits
count,number,Used for reporting,,,24uj-dj8v,General Building Permits
ward,text,City Ward Number,ward_name,area,qd5f-vy6n,2014 Census - Population By School Residency (Neighbourhood)
neighbourhood number,number,Unique Neighbourhood Identifier,neighbourbood_id,area,qd5f-vy6n,2014 Census - Population By School Residency (Neighbourhood)
neighbourhood name,text,Neighbourhood Name,neighbourbood_name,area,qd5f-vy6n,2014 Census - Population By School Residency (Neighbourhood)
public,number,Number of Individuals Supporting School Board,population,population,qd5f-vy6n,2014 Census - Population By School Residency (Neighbourhood)
catholic,number,Number of Individuals Supporting School Board,population,population,qd5f-vy6n,2014 Census - Population By School Residency (Neighbourhood)
no response,number,Number of Individuals that did not Respond,population,population,qd5f-vy6n,2014 Census - Population By School Residency (Neighbourhood)
location description,text,A description of where along the Road Name that the enforcement zone is located,,,epqc-y5cq,All Photo Enforcement Zone Centre Points
speed limit,number,A speed limit that is being monitored and enforced (km/h),,,epqc-y5cq,All Photo Enforcement Zone Centre Points
category,text,General classification of business,,,qhi4-bdpu,City of Edmonton - Business Licenses
legal name,text,Legal Name for the business,,,qhi4-bdpu,City of Edmonton - Business Licenses
trade name,text,Common Name for the business,,,qhi4-bdpu,City of Edmonton - Business Licenses
licence number,text,Unique identifier for a business permit ,,,qhi4-bdpu,City of Edmonton - Business Licenses
licence status,text,"Current Status of Licence - Issued, Expired",,,qhi4-bdpu,City of Edmonton - Business Licenses
issue date,calendar_date,Date Business Licence Issued,date,time,qhi4-bdpu,City of Edmonton - Business Licenses
expiry date,calendar_date,Date Business Licence Is to Expire,date,time,qhi4-bdpu,City of Edmonton - Business Licenses
neighbourhood id,number,Unique number identifier for the Neighbourhood,neighbourbood_id,location,qhi4-bdpu,City of Edmonton - Business Licenses
neighbourhood,text,The name of the Neighbourhood,neighbourbood_name,location,qhi4-bdpu,City of Edmonton - Business Licenses
count,number,Used to create visual reports,,,qhi4-bdpu,City of Edmonton - Business Licenses
responsedate,calendar_date,,date,time,7ph4-x5hn,Speed Smart - Edmonton Insight Community
completiondate,calendar_date,,date,time,7ph4-x5hn,Speed Smart - Edmonton Insight Community
speed smart edmonton.ca webpage,number,,,,7ph4-x5hn,Speed Smart - Edmonton Insight Community
speed smart other:,number,,,,7ph4-x5hn,Speed Smart - Edmonton Insight Community
ostype,text,,,,7ph4-x5hn,Speed Smart - Edmonton Insight Community
devicetype,text,,,,7ph4-x5hn,Speed Smart - Edmonton Insight Community
browsertype,text,,,,7ph4-x5hn,Speed Smart - Edmonton Insight Community
ward,text,City Ward Number,ward_name,area,ec9y-ni5n,2014 Census - Population By Ownership And Length Of Residence (Neighbourhood)
neighbourhood number,number,Unique Neighbourhood Number,neighbourbood_id,area,ec9y-ni5n,2014 Census - Population By Ownership And Length Of Residence (Neighbourhood)
neighbourhood name,text,Neighbourhood Name,neighbourbood_name,area,ec9y-ni5n,2014 Census - Population By Ownership And Length Of Residence (Neighbourhood)
ownership,text,Ownership Type,,,ec9y-ni5n,2014 Census - Population By Ownership And Length Of Residence (Neighbourhood)
5 years or more,number,Number of Units,,,ec9y-ni5n,2014 Census - Population By Ownership And Length Of Residence (Neighbourhood)
no response,number,Number of Units,,,ec9y-ni5n,2014 Census - Population By Ownership And Length Of Residence (Neighbourhood)
structure type,text,Building Structure Type,,,76kk-asiv,2016 Census - Dwelling Unit by Structure Type and Ownership (Citywide)
owned,number,Number of Dwellings that are owned,,,76kk-asiv,2016 Census - Dwelling Unit by Structure Type and Ownership (Citywide)
rented,number,Number of Dwellings that are rented,,,76kk-asiv,2016 Census - Dwelling Unit by Structure Type and Ownership (Citywide)
no response,number,Number of Dwellings that did not Respond,,,76kk-asiv,2016 Census - Dwelling Unit by Structure Type and Ownership (Citywide)
facility type,text,Type of Drainage Facility - default is Inlet-Outlet,,,eu53-j7sn,Drainage - Inlets/Outlets
type,text,Type of Inlet-Outlet - stormwater,,,eu53-j7sn,Drainage - Inlets/Outlets
year constructed,number,Year in which the Inlet-Outlet was built,year,time,eu53-j7sn,Drainage - Inlets/Outlets
neighbourhood id,number,Unique Neighbourhood Identification Number,neighbourbood_id,area,eu53-j7sn,Drainage - Inlets/Outlets
neighbourhood name,text,Name of Neighbourhood Inlet-Outlet is located,neighbourbood_name,area,eu53-j7sn,Drainage - Inlets/Outlets
ward,text,Name of Ward Inlet-Outlet s located,ward_name,area,eu53-j7sn,Drainage - Inlets/Outlets
street / avenue,text,Name of Street / Avenue where Inlet-Outlet is located ,address,location,eu53-j7sn,Drainage - Inlets/Outlets
latitude,number,Latitude coordinates for an Inlet-Outlet,latitude,location,eu53-j7sn,Drainage - Inlets/Outlets
longitude,number,Longitude coordinates for a Inlet-Outlet,longitude,location,eu53-j7sn,Drainage - Inlets/Outlets
location,location,"List of coordinates for a Inlet-Outlet Format (latitude, longitude)",location,location,eu53-j7sn,Drainage - Inlets/Outlets
responsedate,calendar_date,"
Date/Time the respondent first opened/started the survey.
",date,time,6m6z-ybit,New Years Eve Downtown - Edmonton Insight Community
completiondate,calendar_date,"
Date/Time the respondent finished the survey.
",date,time,6m6z-ybit,New Years Eve Downtown - Edmonton Insight Community
ostype,text,"
System Captured, OS used by the respondent. Question: OS Type? - OSType || Possible Answers: Mac (OS X)/Linux/Windows/iOS/Android/BlackBerry/Unknown
",,,6m6z-ybit,New Years Eve Downtown - Edmonton Insight Community
devicetype,text,"
System Captured, Device used by the respondent. Question: Device Type? - DeviceType || Possible Answers: Tablet/Desktop/Phone
",,,6m6z-ybit,New Years Eve Downtown - Edmonton Insight Community
browsertype,text,"
System Captured, Browser used by the respondent. Question: Browser Type? - BrowserType || Possible Answers: Internet Explorer/Firefox/Safari/Google Chrome/Opera/Android/BlackBerry/Unknown
",,,6m6z-ybit,New Years Eve Downtown - Edmonton Insight Community
ward,text,City Ward Number,ward_name,area,hda9-ip2g,2016 Census - Previous Residence If Less Than One Year (Neighbourhood/Ward)
neighbourhood number,number,Unique Neighbourhood Identifier,neighbourbood_id,area,hda9-ip2g,2016 Census - Previous Residence If Less Than One Year (Neighbourhood/Ward)
neighbourhood name,text,Neighbourhood Name,neighbourbood_name,area,hda9-ip2g,2016 Census - Previous Residence If Less Than One Year (Neighbourhood/Ward)
elsewhere in edmonton,number,Number of Individuals for a Particular Location Type,population,population,hda9-ip2g,2016 Census - Previous Residence If Less Than One Year (Neighbourhood/Ward)
elsewhere in alberta,number,Number of Individuals for a Particular Location Type,population,population,hda9-ip2g,2016 Census - Previous Residence If Less Than One Year (Neighbourhood/Ward)
atlantic canada,number,Number of Individuals for a Particular Location Type,population,population,hda9-ip2g,2016 Census - Previous Residence If Less Than One Year (Neighbourhood/Ward)
ontario/quebec,number,Number of Individuals for a Particular Location Type,population,population,hda9-ip2g,2016 Census - Previous Residence If Less Than One Year (Neighbourhood/Ward)
territories/manitoba/saskatchewan,number,Number of Individuals for a Particular Location Type,population,population,hda9-ip2g,2016 Census - Previous Residence If Less Than One Year (Neighbourhood/Ward)
british columbia,number,Number of Individuals for a Particular Location Type,population,population,hda9-ip2g,2016 Census - Previous Residence If Less Than One Year (Neighbourhood/Ward)
outside canada,number,Number of Individuals for a Particular Location Type,population,population,hda9-ip2g,2016 Census - Previous Residence If Less Than One Year (Neighbourhood/Ward)
no response,number,Number of Individuals that did not respond,population,population,hda9-ip2g,2016 Census - Previous Residence If Less Than One Year (Neighbourhood/Ward)
dwelling status,text,Dwelling Status Type,,,bk4g-yv6v,2016 Census - Dwelling Unit Status (Citywide)
dwellings,number,Number of Units,,,bk4g-yv6v,2016 Census - Dwelling Unit Status (Citywide)
ward,text,,,,6x5f-8hj7,2012 Census - Dwelling Units By Structure Type And Length Of Residence (Ward)
structure type,text,,,,6x5f-8hj7,2012 Census - Dwelling Units By Structure Type And Length Of Residence (Ward)
5 years or more,number,,,,6x5f-8hj7,2012 Census - Dwelling Units By Structure Type And Length Of Residence (Ward)
no response,number,,,,6x5f-8hj7,2012 Census - Dwelling Units By Structure Type And Length Of Residence (Ward)
responsedate,calendar_date,,date,time,9kdx-y5ve,Food Council 2017 - Edmonton Insight Community
completiondate,calendar_date,,date,time,9kdx-y5ve,Food Council 2017 - Edmonton Insight Community
gender,text,,gender,sex,9kdx-y5ve,Food Council 2017 - Edmonton Insight Community
age,text,,age,age,9kdx-y5ve,Food Council 2017 - Edmonton Insight Community
education,text,,,,9kdx-y5ve,Food Council 2017 - Edmonton Insight Community
employment status,text,,,,9kdx-y5ve,Food Council 2017 - Edmonton Insight Community
fsa,text,,postal_code,location,9kdx-y5ve,Food Council 2017 - Edmonton Insight Community
ostype,text,,,,9kdx-y5ve,Food Council 2017 - Edmonton Insight Community
devicetype,text,,,,9kdx-y5ve,Food Council 2017 - Edmonton Insight Community
browsertype,text,,,,9kdx-y5ve,Food Council 2017 - Edmonton Insight Community
ward,text,City Ward Number,ward_name,area,7ds8-hpvz,2016 Census - Population by Employment Sector ( Neighbourhood/Ward)
neighbourhood number,number,Unique Neighbourhood Identifier,neighbourbood_id,area,7ds8-hpvz,2016 Census - Population by Employment Sector ( Neighbourhood/Ward)
neighbourhood name,text,Neighbourhood Name,neighbourbood_name,area,7ds8-hpvz,2016 Census - Population by Employment Sector ( Neighbourhood/Ward)
accommodation and food services,number,Number of Persons for particular Employment Sector,population,population,7ds8-hpvz,2016 Census - Population by Employment Sector ( Neighbourhood/Ward)
"administration, waste and remediation",number,Number of Persons for particular Employment Sector,population,population,7ds8-hpvz,2016 Census - Population by Employment Sector ( Neighbourhood/Ward)
construction,number,Number of Persons for particular Employment Sector,population,population,7ds8-hpvz,2016 Census - Population by Employment Sector ( Neighbourhood/Ward)
educational services,number,Number of Persons for particular Employment Sector,population,population,7ds8-hpvz,2016 Census - Population by Employment Sector ( Neighbourhood/Ward)
manufacturing,number,Number of Persons for particular Employment Sector,population,population,7ds8-hpvz,2016 Census - Population by Employment Sector ( Neighbourhood/Ward)
public administration,number,Number of Persons for particular Employment Sector,population,population,7ds8-hpvz,2016 Census - Population by Employment Sector ( Neighbourhood/Ward)
transportation and warehousing,number,Number of Persons for particular Employment Sector,population,population,7ds8-hpvz,2016 Census - Population by Employment Sector ( Neighbourhood/Ward)
utilities,number,Number of Persons for particular Employment Sector,population,population,7ds8-hpvz,2016 Census - Population by Employment Sector ( Neighbourhood/Ward)
wholesale and retail trade,number,Number of Persons for particular Employment Sector,population,population,7ds8-hpvz,2016 Census - Population by Employment Sector ( Neighbourhood/Ward)
other,number,Number of Persons for particular Employment Sector,population,population,7ds8-hpvz,2016 Census - Population by Employment Sector ( Neighbourhood/Ward)
